{
  "schema_version": "h01-external-reference-v1",
  "reference_id": "X-FIXTURE-NOT-YET-CREATED",
  "reference_kind": "fixture",
  "locator": "tests/harness/fixtures/synthetic/not-yet-created.json",
  "status": "active",
  "scope": "harness-engineering",
  "source_refs": ["A-HARNESS-ENGINEERING-PRINCIPLES"]
}
